{
  "contract": {
    "name": "hausman-hub-device-feature-matrix",
    "version": 1
  },
  "apiMajorVersion": 1,
  "authority": {
    "semantics": "upper_bound",
    "runtimeActionSource": "scenario_catalog",
    "unknownTypePolicy": "read_only",
    "unknownControlPolicy": "hidden",
    "clientMaySynthesizeActions": false
  },
  "deviceTypes": [
    {"type": "alarm_control_panel", "title": "Охранная система", "category": "security", "readOnly": true, "controls": []},
    {"type": "binary_sensor", "title": "Датчики", "category": "devices", "readOnly": true, "controls": []},
    {"type": "button", "title": "Кнопки", "category": "devices", "readOnly": false, "controls": [
      {"id": "press", "kind": "momentary", "actionIds": ["press"], "valueType": "none", "valueSource": "none", "receiptRequired": true}
    ]},
    {"type": "camera", "title": "Камеры", "category": "security", "readOnly": true, "controls": []},
    {"type": "climate", "title": "Кондиционеры", "category": "climate", "readOnly": false, "controls": [
      {"id": "power", "kind": "binary", "actionIds": ["turn_on", "turn_off"], "valueType": "none", "valueSource": "none", "receiptRequired": true},
      {"id": "temperature", "kind": "range", "actionIds": ["set_temperature"], "valueType": "number", "valueSource": "runtime_bounds", "receiptRequired": true},
      {"id": "hvac_mode", "kind": "enum", "actionIds": ["set_hvac_mode"], "valueType": "string", "valueSource": "runtime_options", "receiptRequired": true},
      {"id": "fan_mode", "kind": "enum", "actionIds": ["set_fan_mode"], "valueType": "string", "valueSource": "runtime_options", "receiptRequired": true}
    ]},
    {"type": "cover", "title": "Шторы и ворота", "category": "devices", "readOnly": false, "controls": [
      {"id": "open_close", "kind": "binary", "actionIds": ["open_cover", "close_cover"], "valueType": "none", "valueSource": "none", "receiptRequired": true},
      {"id": "position", "kind": "range", "actionIds": ["set_position"], "valueType": "number", "valueSource": "contract_bounds", "minimum": 0, "maximum": 100, "receiptRequired": true}
    ]},
    {"type": "fan", "title": "Вентиляция", "category": "climate", "readOnly": false, "controls": [
      {"id": "power", "kind": "binary", "actionIds": ["turn_on", "turn_off", "toggle"], "valueType": "none", "valueSource": "none", "receiptRequired": true}
    ]},
    {"type": "humidifier", "title": "Увлажнители", "category": "climate", "readOnly": false, "controls": [
      {"id": "power", "kind": "binary", "actionIds": ["turn_on", "turn_off"], "valueType": "none", "valueSource": "none", "receiptRequired": true},
      {"id": "humidity", "kind": "range", "actionIds": ["set_humidity"], "valueType": "number", "valueSource": "runtime_bounds", "receiptRequired": true}
    ]},
    {"type": "light", "title": "Освещение", "category": "lighting", "readOnly": false, "controls": [
      {"id": "power", "kind": "binary", "actionIds": ["turn_on", "turn_off", "toggle"], "valueType": "none", "valueSource": "none", "receiptRequired": true},
      {"id": "brightness", "kind": "range", "actionIds": ["set_brightness"], "valueType": "number", "valueSource": "contract_bounds", "minimum": 0, "maximum": 255, "receiptRequired": true},
      {"id": "adaptive_brightness", "kind": "range", "actionIds": ["set_adaptive_brightness"], "valueType": "number", "valueSource": "contract_bounds", "minimum": 1, "maximum": 100, "receiptRequired": true},
      {"id": "brightness_percent", "kind": "range", "actionIds": ["set_brightness_percent"], "valueType": "number", "valueSource": "contract_bounds", "minimum": 0, "maximum": 100, "receiptRequired": true},
      {"id": "color_temperature", "kind": "range", "actionIds": ["set_color_temperature"], "valueType": "number", "valueSource": "contract_bounds", "minimum": 1000, "maximum": 10000, "receiptRequired": true},
      {"id": "night_light", "kind": "range", "actionIds": ["set_night_light"], "valueType": "number", "valueSource": "contract_bounds", "minimum": 1, "maximum": 30, "receiptRequired": true},
      {"id": "rgb_color", "kind": "enum", "actionIds": ["set_rgb_color"], "valueType": "string", "valueSource": "runtime_options", "receiptRequired": true}
    ]},
    {"type": "lock", "title": "Замки", "category": "security", "readOnly": false, "controls": [
      {"id": "lock", "kind": "binary", "actionIds": ["lock", "unlock"], "valueType": "none", "valueSource": "none", "receiptRequired": true}
    ]},
    {"type": "media_player", "title": "Медиа", "category": "media", "readOnly": false, "controls": [
      {"id": "power", "kind": "binary", "actionIds": ["turn_on", "turn_off"], "valueType": "none", "valueSource": "none", "receiptRequired": true},
      {"id": "playback", "kind": "transport", "actionIds": ["media_play", "media_pause"], "valueType": "none", "valueSource": "none", "receiptRequired": true}
    ]},
    {"type": "number", "title": "Настройки", "category": "devices", "readOnly": false, "controls": [
      {"id": "value", "kind": "range", "actionIds": ["set_value"], "valueType": "number", "valueSource": "runtime_bounds", "receiptRequired": true}
    ]},
    {"type": "select", "title": "Режимы", "category": "devices", "readOnly": true, "controls": []},
    {"type": "sensor", "title": "Датчики", "category": "devices", "readOnly": true, "controls": []},
    {"type": "sun", "title": "Солнце", "category": "devices", "readOnly": true, "controls": []},
    {"type": "switch", "title": "Выключатели", "category": "devices", "readOnly": false, "controls": [
      {"id": "power", "kind": "binary", "actionIds": ["turn_on", "turn_off", "toggle"], "valueType": "none", "valueSource": "none", "receiptRequired": true}
    ]},
    {"type": "vacuum", "title": "Пылесосы", "category": "devices", "readOnly": false, "controls": [
      {"id": "cleaning", "kind": "transport", "actionIds": ["start", "pause", "stop", "return_home"], "valueType": "none", "valueSource": "none", "receiptRequired": true}
    ]},
    {"type": "valve", "title": "Клапаны", "category": "devices", "readOnly": false, "controls": [
      {"id": "open_close", "kind": "binary", "actionIds": ["open_valve", "close_valve"], "valueType": "none", "valueSource": "none", "receiptRequired": true},
      {"id": "position", "kind": "range", "actionIds": ["set_position"], "valueType": "number", "valueSource": "contract_bounds", "minimum": 0, "maximum": 100, "receiptRequired": true}
    ]},
    {"type": "water_heater", "title": "Нагрев воды", "category": "climate", "readOnly": false, "controls": [
      {"id": "power", "kind": "binary", "actionIds": ["turn_on", "turn_off"], "valueType": "none", "valueSource": "none", "receiptRequired": true},
      {"id": "temperature", "kind": "range", "actionIds": ["set_temperature"], "valueType": "number", "valueSource": "runtime_bounds", "receiptRequired": true},
      {"id": "operation_mode", "kind": "enum", "actionIds": ["set_operation_mode"], "valueType": "string", "valueSource": "runtime_options", "receiptRequired": true}
    ]}
  ]
}
